{
  "ca": "944fTeZPkMwdUp6yWmuk9Q9uUt44MEuerY3Efjfhpump",
  "id": 12855,
  "chain": "SOLANA",
  "kol_id": 6,
  "source": "frontrun_search",
  "content": "🚨 $WIFSI (Super Wif Inu) x2\n\n📊 MC: $13.6K | Liq: $8.2K\n💵 Vol 24h: $7.7K\n🔄 Buys/Sells: 80 / 54\n\n📋 CA:\n944fTeZPkMwdUp6yWmuk9Q9uUt44MEuerY3Efjfhpump\n\n🤖 Full scan + chart → link in bio\n\n#WIFSI #solhousesignal #gem #100x #altcoin https://t.co/gnsLcIJo9p",
  "token_id": 62582,
  "tweet_id": "2112595383020921195",
  "is_deleted": false,
  "tweet_time": "2026-10-20T17:22:44+00:00",
  "view_count": null,
  "quote_count": 0,
  "reply_count": 0,
  "first_seen_at": "2026-10-20T19:51:39.952702+00:00",
  "retweet_count": 0,
  "favorite_count": 0
}
